<?xml version="1.0" encoding="UTF-8"?>
<!DOCTYPE deREschema SYSTEM "dere.dtd">
<!-- http://2011.bionlp-st.org/home/genia-event-extraction-genia -->
<deREschema name="BioNLP-ST 2009" version="0.01" author="Roman Klinger">
  <uniontype name="Regulation" includes="Regulation,Positive Regulation,Negative Regulation"/>
  <spantypes>
    <span name="Gene"/>
    <span name="Trigger"/>
  </spantypes>
  <frames>
    <frame name="Regulation">
      <slot name="EventTrigger" types="Trigger" mincardinality="1" maxcardinality="1"/>
      <slot name="Cause" types="Gene" mincardinality="0" maxcardinality="1"/>
      <slot name="Theme" types="Gene,Regulation,Positive Regulation,Negative Regulation" mincardinality="1" maxcardinality="1"/>
    </frame>
    <frame name="Positive Regulation">
      <slot name="EventTrigger" types="Trigger" cardinality="1"/>
      <slot name="Cause" types="Gene" mincardinality="0" maxcardinality="1"/>
      <slot name="Theme" types="Gene,Regulation,Positive Regulation,Negative Regulation" cardinality="1"/>
    </frame>
    <frame  name="Negative Regulation">
      <slot name="EventTrigger" types="Trigger" cardinality="1"/>
      <slot name="Cause" types="Gene" mincardinality="0" maxcardinality="1"/>
      <slot name="Theme" types="Gene,Regulation,Positive Regulation,Negative Regulation" cardinality="1"/>
    </frame>
    <frame name="Binding">
      <slot name="EventTrigger" types="Trigger" cardinality="1"/>
      <slot name="Theme" types="Gene" mincardinality="1"/>
    </frame>
    <frame name="Transcription">
      <slot name="EventTrigger" types="Trigger" cardinality="1"/>
      <slot name="Theme" types="Gene" cardinality="1"/>
    </frame>
    <frame name="Protein Catabolism">
      <slot name="EventTrigger" types="Trigger" cardinality="1"/>
      <slot name="Theme" types="Gene" cardinality="1"/>
    </frame>
    <frame name="Phosporylization">
      <slot name="EventTrigger" types="Trigger" cardinality="1"/>
      <slot name="Theme" types="Gene" cardinality="1"/>
    </frame>
    <frame name="Localization">
      <slot name="EventTrigger" types="Trigger" cardinality="1"/>
      <slot name="Theme" types="Gene" cardinality="1"/>
    </frame>
  </frames>
</deREschema>
